year,plan
2025,"The Board approved a $610,000 allocation to fund the scholarship program, with $700,000 earmarked for multi-year commitments and $795,000 reserved for expansion. Beyond funding, the plan includes establishing a formal governance structure with rotating faculty and community representation, deploying a cloud-based application portal integrated with demographic tracking tools, and setting up a compliance dashboard to monitor disbursements against both donor requirements and internal equity benchmarks."
2024,"The cooperative committed $590,000 in base funding, supplemented by $680,000 in matching donor contributions, and a capped reserve of $800,000 for sustainability. Implementation extended to negotiating partnership agreements with three regional universities, developing a comprehensive communications strategy targeting underrepresented populations, and instituting quarterly financial and programmatic audits designed to increase accountability while providing data-driven insights for future cycles."
2023,"A $575,000 allocation was designated for scholarship awards, with $660,000 set aside for administrative and mentoring programs, and $790,000 dedicated to long-term program reserves. The program expanded eligibility criteria to include non-traditional students, introduced a tiered mentorship initiative linking awardees to alumni professionals, and incorporated a weighted scoring model that factored socioeconomic disadvantage, leadership potential, and academic performance into a unified selection index."
2022,"Funding commitments included $560,000 in direct awards, $640,000 in supplemental resources, and $770,000 toward building an endowment to secure future scholarship stability. To ensure sustainability, the Board directed efforts toward creating a donor recognition architecture with multi-level giving tiers, commissioning an external evaluation firm to assess equity impacts, and piloting a digital case management system to centralize all awardee records and progress reporting."
2021,"The Board authorized $545,000 in core funding for scholarships, $625,000 to cover rising operational costs, and $755,000 to strengthen the reserve pool. Additional measures included developing standardized training for selection committee members on implicit bias, launching a scholarship recipient alumni network for long-term engagement, and drafting a five-year projection model aligning scholarship disbursements with anticipated inflation and regional cost-of-living increases."
2020,"Initial allocation of $520,000 was directed to award scholarships, supplemented with $610,000 in matching grants and $735,000 held in restricted funds. Implementation included drafting the foundational program charter, designing a transparent application scoring rubric, conducting stakeholder listening sessions across community groups, and commissioning the cooperative’s first impact report to benchmark outcomes against peer scholarship programs in the region."
